{
  "schema_version": "2026-06-26",
  "privacy_mode": "local_only",
  "profile": {},
  "course_memory": [],
  "lecture_delta_memory": [],
  "writing_voice": {
    "samples": [],
    "inferred_rules": [],
    "revision_rules": []
  },
  "notes_preferences": [],
  "exam_preparation_preferences": [],
  "application_preferences": [],
  "source_log": [],
  "conflicts": []
}
